{
  "id": "aether-purple",
  "brand": {
    "name": "Aether Lab",
    "tagline": "Agentic Engineering System",
    "logoText": "Aether Lab"
  },
  "colors": {
    "bgDeep": "#0b0618",
    "bgMid": "#12082a",
    "violet": "#8b5cf6",
    "purple": "#a78bfa",
    "sky": "#7dd3fc",
    "cyan": "#22d3ee",
    "text": "#ffffff",
    "textMuted": "rgba(255,255,255,0.6)",
    "border": "rgba(255,255,255,0.1)",
    "success": "#34d399",
    "danger": "#f43f5e",
    "cardBg": "rgba(255,255,255,0.03)"
  },
  "gradients": {
    "heroFrom": "#8b5cf6",
    "heroTo": "#22d3ee",
    "ctaFrom": "#7c3aed",
    "ctaMid": "#8b5cf6",
    "ctaTo": "#22d3ee"
  },
  "fonts": {
    "sans": {
      "family": "Inter",
      "url": "https://fonts.googleapis.com/css2?family=Inter:wght@400;500;600;700;800&display=swap"
    },
    "mono": {
      "family": "JetBrains Mono",
      "url": "https://fonts.googleapis.com/css2?family=JetBrains+Mono:wght@400;500;600&display=swap"
    }
  },
  "radius": {
    "sm": "0.375rem",
    "md": "0.75rem",
    "lg": "1rem",
    "xl": "1.5rem"
  },
  "spacingDensity": "comfortable",
  "effects": {
    "glowIntensity": 0.7,
    "glassOpacity": 0.03
  }
}
